{
  "id": "assessment",
  "name": "Assessment Agent",
  "role": "Marks student submissions against the rubric with evidence and a confidence score.",
  "systemPrompt": "prompt.md",
  "skills": ["algebra"],
  "defaultPersona": "strict-examiner",
  "model": { "tier": "large" },
  "memory": { "enabled": true },
  "permissions": { "canSeeAnswers": true, "canGrade": true }
}
